title,description,date,price,postcode,visibility,category,product_img
Bananas,Good Quality Bananas never have any problems with them last long time; could be more flavorful,2022-06-02,0.33,S10 3AP,0,1,Bananas.jpg
Potato,Theres always lots of bigger ones to use for jacket potatoes,2022-05-20,0.00,S1 4BA,0,2,Potato.jpeg
Pizza,Try Goodfella's Stonebaked Thin Crust Pepperoni Pizza - a signature classic that's as timeless as it is delicious.,2022-05-21,0.99,S10 3AP,0,4,Pizza.jpg
Sweet Corn,Teflon quality tested nonstick coatings; Easy clean; convenience; classic; Suitable for all hobs excluding induction,2022-12-12,1.00,S10 3AP,0,10,corn.jpg
Bea,What can you say about Heinz Baked Beans? One of the best mass produced products in the world! If you've got beans; you've got a meal.,2022-06-11,0.09,S1 4BA,0,5,Bean_Can.jpg
Bread,When you've been baking bread for 130 years you learn a thing or two about how to make a great loaf. Our traditional Farmhouse loaf has a delicious fresh bread taste and is dusted with flour to create the perfect When you've been baking bread for 130 years you learn a thing or two about how to make a great loaf. Our traditional Farmhouse loaf has a delicious fresh bread taste and is dusted with flour to create the perfect When you've been baking bread for 130 years you learn a thing or two about how to make a great loaf. Our traditional Farmhouse loaf has a delicious fresh bread taste and is dusted with flour to create the perfect slice for toast or sandwiches.,2022-05-19,0.01,S10 3AP,0,7,Bread.jpg
Cola,Enjoy the light taste of Diet Pepsi; best served chilled or over ice. Ideal for parties; meals; and celebrations big and small and every day,2022-05-31,0.50,S10 3AP,0,9,Cola.jpg
Beer,Crafted with the finest ingredients to deliver a deep gold amber beer with a clean finish and fruity overtones. The blend of fuggles and goldings - the classic twin hop masterpiece delivers a classic English beer.,2022-07-08,0.39,S10 3AP,0,6,Beer.jpg